{
  "schema_version": 1,
  "provider_free": true,
  "live_network": false,
  "finding_kinds": [
    "dataset_manifest_invalid",
    "case_input_invalid",
    "metric_gate_failed",
    "judge_replay_request_mismatch",
    "judge_replay_exhausted",
    "judge_replay_unconsumed"
  ],
  "findings": []
}
